{
  "model_id": "bedashing-network-geometry-v1",
  "input_snapshot_id": "bedashing-branches-v2-2026-09-09",
  "source_ids": [
    "2gis_branch_roster",
    "city_walk_outlet",
    "user_branch_location_validation_2026_09_09",
    "waze_khalifa_city",
    "waze_mirdif_35"
  ],
  "primary_radius_km": 3,
  "radius_bands_km": [
    1,
    3,
    5
  ],
  "distance_method": "haversine",
  "overlap_method": "analytic_equal_radius_circle_intersection",
  "interpretation": "Service radii are geometric distance bands for sensitivity analysis. They are not drive-time isochrones, actual customer catchments, or evidence of cannibalization by themselves.",
  "assumptions": [
    "At 1\u20135 km bands, planar circle-intersection area is a transparent approximation after great-circle distance is calculated.",
    "Overlap is a screening signal only; branch archetype, demand, customer-origin data, and operational performance are not yet included."
  ],
  "branch_metrics": [
    {
      "branch_id": "pinnacle_building",
      "nearest_own_branch_id": "city_walk_building_18a",
      "nearest_own_branch_distance_km": 13.050824,
      "service_radius_metrics": [
        {
          "radius_km": 1,
          "overlapping_branch_count": 0,
          "sum_pairwise_intersection_area_km2": 0,
          "maximum_pairwise_overlap_coefficient": 0.0
        },
        {
          "radius_km": 3,
          "overlapping_branch_count": 0,
          "sum_pairwise_intersection_area_km2": 0,
          "maximum_pairwise_overlap_coefficient": 0.0
        },
        {
          "radius_km": 5,
          "overlapping_branch_count": 0,
          "sum_pairwise_intersection_area_km2": 0,
          "maximum_pairwise_overlap_coefficient": 0.0
        }
      ]
    },
    {
      "branch_id": "city_walk_building_18a",
      "nearest_own_branch_id": "nad_al_sheba_mall",
      "nearest_own_branch_distance_km": 11.579057,
      "service_radius_metrics": [
        {
          "radius_km": 1,
          "overlapping_branch_count": 0,
          "sum_pairwise_intersection_area_km2": 0,
          "maximum_pairwise_overlap_coefficient": 0.0
        },
        {
          "radius_km": 3,
          "overlapping_branch_count": 0,
          "sum_pairwise_intersection_area_km2": 0,
          "maximum_pairwise_overlap_coefficient": 0.0
        },
        {
          "radius_km": 5,
          "overlapping_branch_count": 0,
          "sum_pairwise_intersection_area_km2": 0,
          "maximum_pairwise_overlap_coefficient": 0.0
        }
      ]
    },
    {
      "branch_id": "nad_al_sheba_mall",
      "nearest_own_branch_id": "mirdif_35",
      "nearest_own_branch_distance_km": 10.288789,
      "service_radius_metrics": [
        {
          "radius_km": 1,
          "overlapping_branch_count": 0,
          "sum_pairwise_intersection_area_km2": 0,
          "maximum_pairwise_overlap_coefficient": 0.0
        },
        {
          "radius_km": 3,
          "overlapping_branch_count": 0,
          "sum_pairwise_intersection_area_km2": 0,
          "maximum_pairwise_overlap_coefficient": 0.0
        },
        {
          "radius_km": 5,
          "overlapping_branch_count": 0,
          "sum_pairwise_intersection_area_km2": 0,
          "maximum_pairwise_overlap_coefficient": 0.0
        }
      ]
    },
    {
      "branch_id": "mirdif_35",
      "nearest_own_branch_id": "nad_al_sheba_mall",
      "nearest_own_branch_distance_km": 10.288789,
      "service_radius_metrics": [
        {
          "radius_km": 1,
          "overlapping_branch_count": 0,
          "sum_pairwise_intersection_area_km2": 0,
          "maximum_pairwise_overlap_coefficient": 0.0
        },
        {
          "radius_km": 3,
          "overlapping_branch_count": 0,
          "sum_pairwise_intersection_area_km2": 0,
          "maximum_pairwise_overlap_coefficient": 0.0
        },
        {
          "radius_km": 5,
          "overlapping_branch_count": 0,
          "sum_pairwise_intersection_area_km2": 0,
          "maximum_pairwise_overlap_coefficient": 0.0
        }
      ]
    },
    {
      "branch_id": "al_husna_street",
      "nearest_own_branch_id": "zayed_international_airport",
      "nearest_own_branch_distance_km": 10.132774,
      "service_radius_metrics": [
        {
          "radius_km": 1,
          "overlapping_branch_count": 0,
          "sum_pairwise_intersection_area_km2": 0,
          "maximum_pairwise_overlap_coefficient": 0.0
        },
        {
          "radius_km": 3,
          "overlapping_branch_count": 0,
          "sum_pairwise_intersection_area_km2": 0,
          "maximum_pairwise_overlap_coefficient": 0.0
        },
        {
          "radius_km": 5,
          "overlapping_branch_count": 0,
          "sum_pairwise_intersection_area_km2": 0,
          "maximum_pairwise_overlap_coefficient": 0.0
        }
      ]
    },
    {
      "branch_id": "zawaya_walk",
      "nearest_own_branch_id": "misk_2",
      "nearest_own_branch_distance_km": 5.195413,
      "service_radius_metrics": [
        {
          "radius_km": 1,
          "overlapping_branch_count": 0,
          "sum_pairwise_intersection_area_km2": 0,
          "maximum_pairwise_overlap_coefficient": 0.0
        },
        {
          "radius_km": 3,
          "overlapping_branch_count": 1,
          "sum_pairwise_intersection_area_km2": 1.632767,
          "maximum_pairwise_overlap_coefficient": 0.057747
        },
        {
          "radius_km": 5,
          "overlapping_branch_count": 1,
          "sum_pairwise_intersection_area_km2": 29.02813,
          "maximum_pairwise_overlap_coefficient": 0.369598
        }
      ]
    },
    {
      "branch_id": "misk_2",
      "nearest_own_branch_id": "zawaya_walk",
      "nearest_own_branch_distance_km": 5.195413,
      "service_radius_metrics": [
        {
          "radius_km": 1,
          "overlapping_branch_count": 0,
          "sum_pairwise_intersection_area_km2": 0,
          "maximum_pairwise_overlap_coefficient": 0.0
        },
        {
          "radius_km": 3,
          "overlapping_branch_count": 1,
          "sum_pairwise_intersection_area_km2": 1.632767,
          "maximum_pairwise_overlap_coefficient": 0.057747
        },
        {
          "radius_km": 5,
          "overlapping_branch_count": 1,
          "sum_pairwise_intersection_area_km2": 29.02813,
          "maximum_pairwise_overlap_coefficient": 0.369598
        }
      ]
    },
    {
      "branch_id": "deerfields_mall",
      "nearest_own_branch_id": "noya_plaza_mall",
      "nearest_own_branch_distance_km": 5.487871,
      "service_radius_metrics": [
        {
          "radius_km": 1,
          "overlapping_branch_count": 0,
          "sum_pairwise_intersection_area_km2": 0,
          "maximum_pairwise_overlap_coefficient": 0.0
        },
        {
          "radius_km": 3,
          "overlapping_branch_count": 1,
          "sum_pairwise_intersection_area_km2": 0.835465,
          "maximum_pairwise_overlap_coefficient": 0.029549
        },
        {
          "radius_km": 5,
          "overlapping_branch_count": 3,
          "sum_pairwise_intersection_area_km2": 33.290337,
          "maximum_pairwise_overlap_coefficient": 0.33812
        }
      ]
    },
    {
      "branch_id": "noya_plaza_mall",
      "nearest_own_branch_id": "west_yas_plaza",
      "nearest_own_branch_distance_km": 3.864564,
      "service_radius_metrics": [
        {
          "radius_km": 1,
          "overlapping_branch_count": 0,
          "sum_pairwise_intersection_area_km2": 0,
          "maximum_pairwise_overlap_coefficient": 0.0
        },
        {
          "radius_km": 3,
          "overlapping_branch_count": 3,
          "sum_pairwise_intersection_area_km2": 8.445369,
          "maximum_pairwise_overlap_coefficient": 0.240808
        },
        {
          "radius_km": 5,
          "overlapping_branch_count": 4,
          "sum_pairwise_intersection_area_km2": 107.698038,
          "maximum_pairwise_overlap_coefficient": 0.520487
        }
      ]
    },
    {
      "branch_id": "west_yas_plaza",
      "nearest_own_branch_id": "noya_plaza_mall",
      "nearest_own_branch_distance_km": 3.864564,
      "service_radius_metrics": [
        {
          "radius_km": 1,
          "overlapping_branch_count": 0,
          "sum_pairwise_intersection_area_km2": 0,
          "maximum_pairwise_overlap_coefficient": 0.0
        },
        {
          "radius_km": 3,
          "overlapping_branch_count": 1,
          "sum_pairwise_intersection_area_km2": 6.808694,
          "maximum_pairwise_overlap_coefficient": 0.240808
        },
        {
          "radius_km": 5,
          "overlapping_branch_count": 4,
          "sum_pairwise_intersection_area_km2": 79.101109,
          "maximum_pairwise_overlap_coefficient": 0.520487
        }
      ]
    },
    {
      "branch_id": "khalifa_city_al_mireef",
      "nearest_own_branch_id": "zayed_international_airport",
      "nearest_own_branch_distance_km": 4.390352,
      "service_radius_metrics": [
        {
          "radius_km": 1,
          "overlapping_branch_count": 0,
          "sum_pairwise_intersection_area_km2": 0,
          "maximum_pairwise_overlap_coefficient": 0.0
        },
        {
          "radius_km": 3,
          "overlapping_branch_count": 1,
          "sum_pairwise_intersection_area_km2": 4.52165,
          "maximum_pairwise_overlap_coefficient": 0.159921
        },
        {
          "radius_km": 5,
          "overlapping_branch_count": 3,
          "sum_pairwise_intersection_area_km2": 71.743243,
          "maximum_pairwise_overlap_coefficient": 0.45952
        }
      ]
    },
    {
      "branch_id": "zayed_international_airport",
      "nearest_own_branch_id": "khalifa_city_al_mireef",
      "nearest_own_branch_distance_km": 4.390352,
      "service_radius_metrics": [
        {
          "radius_km": 1,
          "overlapping_branch_count": 0,
          "sum_pairwise_intersection_area_km2": 0,
          "maximum_pairwise_overlap_coefficient": 0.0